{
  "$schema": "https://json-schema.org/draft/2020-12/schema",
  "$id": "https://simplecad.dev/schemas/rules-1.schema.json",
  "type": "object",
  "additionalProperties": false,
  "required": ["schema_version", "registry_id", "phases", "rules"],
  "properties": {
    "schema_version": {"const": "1.0"},
    "registry_id": {"const": "scene-1.0-rules"},
    "phases": {"const": ["parse", "structure", "semantic", "package", "budget"]},
    "rules": {"type": "array", "minItems": 1, "items": {"$ref": "#/$defs/rule"}}
  },
  "$defs": {
    "rule": {"type": "object", "additionalProperties": false, "required": ["id", "phase", "precedence", "artifacts", "pointer_policy", "summary"], "properties": {
      "id": {"type": "string", "pattern": "^[a-z][a-z0-9_]*$"},
      "phase": {"enum": ["parse", "structure", "semantic", "package", "budget"]},
      "precedence": {"type": "integer", "minimum": 0},
      "artifacts": {"type": "array", "minItems": 1, "uniqueItems": true, "items": {"enum": ["scene", "entities", "presentation", "connector_binding", "normalized_product", "package", "glb", "zip"]}},
      "pointer_policy": {"enum": ["exact", "nearest_record", "root"]},
      "summary": {"type": "string", "minLength": 1}
    }}
  }
}
