{
  "phases": ["parse", "structure", "semantic", "package", "budget"],
  "registry_id": "scene-1.0-rules",
  "rules": [
    {"artifacts": ["scene", "entities", "presentation", "connector_binding", "normalized_product", "package"], "id": "bom_forbidden", "phase": "parse", "pointer_policy": "root", "precedence": 0, "summary": "UTF-8 BOM is forbidden."},
    {"artifacts": ["scene", "entities", "presentation", "connector_binding", "normalized_product", "package"], "id": "duplicate_json_key", "phase": "parse", "pointer_policy": "root", "precedence": 1, "summary": "Duplicate JSON object members are forbidden."},
    {"artifacts": ["scene", "entities", "presentation", "connector_binding", "normalized_product", "package"], "id": "invalid_utf8", "phase": "parse", "pointer_policy": "exact", "precedence": 2, "summary": "JSON must use strict UTF-8."},
    {"artifacts": ["scene", "entities", "presentation", "connector_binding", "normalized_product", "package"], "id": "noncanonical_json", "phase": "parse", "pointer_policy": "root", "precedence": 3, "summary": "Canonical package JSON must be exact RFC 8785 JCS bytes."},
    {"artifacts": ["scene", "entities", "presentation", "connector_binding", "normalized_product", "package"], "id": "nonfinite_json_number", "phase": "parse", "pointer_policy": "exact", "precedence": 4, "summary": "NaN and infinities are forbidden."},
    {"artifacts": ["scene", "entities", "presentation", "connector_binding", "normalized_product", "package"], "id": "schema_invalid", "phase": "structure", "pointer_policy": "exact", "precedence": 0, "summary": "The artifact must satisfy its closed JSON Schema 2020-12 schema."},
    {"artifacts": ["entities", "package"], "id": "analytic_geometry_invalid", "phase": "semantic", "pointer_policy": "nearest_record", "precedence": 0, "summary": "Analytic axes and direction vectors must be finite, normalized, and mutually orthogonal where required."},
    {"artifacts": ["scene", "entities", "presentation", "connector_binding", "normalized_product", "package"], "id": "array_order_invalid", "phase": "semantic", "pointer_policy": "exact", "precedence": 1, "summary": "Set-like arrays must use the registered unsigned UTF-8 ordering."},
    {"artifacts": ["scene", "entities", "presentation", "normalized_product", "package"], "id": "bounds_invalid", "phase": "semantic", "pointer_policy": "nearest_record", "precedence": 2, "summary": "Bounds and contained points must satisfy the numeric profile."},
    {"artifacts": ["scene", "entities", "connector_binding", "package"], "id": "connector_invalid", "phase": "semantic", "pointer_policy": "nearest_record", "precedence": 3, "summary": "Connector owner, public source, target, and frame rules must hold."},
    {"artifacts": ["entities", "package"], "id": "entity_range_invalid", "phase": "semantic", "pointer_policy": "nearest_record", "precedence": 4, "summary": "Face and rendered-edge ranges must form exact positive partitions."},
    {"artifacts": ["entities", "package"], "id": "entity_topology_invalid", "phase": "semantic", "pointer_policy": "nearest_record", "precedence": 5, "summary": "Entity ownership, cardinality, and reciprocal adjacency must be valid."},
    {"artifacts": ["scene", "package"], "id": "hierarchy_invalid", "phase": "semantic", "pointer_policy": "nearest_record", "precedence": 6, "summary": "Scene hierarchy must be acyclic, rooted, and continuously ordered."},
    {"artifacts": ["scene", "entities", "presentation", "normalized_product", "package"], "id": "id_duplicate", "phase": "semantic", "pointer_policy": "exact", "precedence": 7, "summary": "Identifiers must be unique in their declared scope."},
    {"artifacts": ["presentation"], "id": "presentation_reference_invalid", "phase": "semantic", "pointer_policy": "exact", "precedence": 8, "summary": "Presentation names and references must be unique and resolvable."},
    {"artifacts": ["scene", "entities", "normalized_product", "package"], "id": "reference_missing", "phase": "semantic", "pointer_policy": "exact", "precedence": 9, "summary": "Every typed reference must resolve in its declared registry."},
    {"artifacts": ["scene", "package"], "id": "revision_mismatch", "phase": "semantic", "pointer_policy": "exact", "precedence": 10, "summary": "Scene revision must equal the two-pass JCS hash."},
    {"artifacts": ["scene", "entities", "connector_binding", "package"], "id": "source_matrix_invalid", "phase": "semantic", "pointer_policy": "nearest_record", "precedence": 11, "summary": "Top-level, definition, node, entity, connector, and appearance sources must agree."},
    {"artifacts": ["scene", "entities", "presentation", "package"], "id": "transform_invalid", "phase": "semantic", "pointer_policy": "nearest_record", "precedence": 12, "summary": "Rigid transforms must satisfy the exact right-handed numeric profile."},
    {"artifacts": ["package"], "id": "blob_hash_mismatch", "phase": "package", "pointer_policy": "exact", "precedence": 0, "summary": "Referenced immutable bytes must match the declared SHA-256."},
    {"artifacts": ["package"], "id": "blob_length_mismatch", "phase": "package", "pointer_policy": "exact", "precedence": 1, "summary": "Referenced immutable bytes must match the declared byte length."},
    {"artifacts": ["glb", "package"], "id": "glb_profile_invalid", "phase": "package", "pointer_policy": "exact", "precedence": 2, "summary": "GLB bytes must match the exact closed triangle or line profile."},
    {"artifacts": ["package"], "id": "package_member_set_invalid", "phase": "package", "pointer_policy": "root", "precedence": 3, "summary": "Package blob keys must exactly equal manifest URI references; archive validation separately requires scene.json."},
    {"artifacts": ["zip"], "id": "zip_profile_invalid", "phase": "package", "pointer_policy": "root", "precedence": 4, "summary": "ZIP headers, names, methods, CRCs, and envelope must match the allowlist."},
    {"artifacts": ["zip"], "id": "archive_limit_exceeded", "phase": "budget", "pointer_policy": "root", "precedence": 0, "summary": "Archive preflight limits must hold before payload allocation."},
    {"artifacts": ["scene", "entities", "presentation", "connector_binding", "normalized_product", "package", "glb"], "id": "resource_limit_exceeded", "phase": "budget", "pointer_policy": "nearest_record", "precedence": 1, "summary": "Artifact counts and sizes must remain within the Base profile."},
    {"artifacts": ["package"], "id": "static_buffer_limit_exceeded", "phase": "budget", "pointer_policy": "root", "precedence": 2, "summary": "The static decoded CPU/GPU buffer formula must not exceed 512 MiB."}
  ],
  "schema_version": "1.0"
}
